{
  "contractVersion": "m3-1-external-attestation-proof-v1",
  "proofId": "proof_untrusted_fixture_001",
  "proofType": "github-oidc-transparency-attestation",
  "purpose": "holdout-freeze",
  "issuedAt": "2026-08-23T00:00:00Z",
  "serialNumber": "untrusted-proof-serial-001",
  "sequence": 1,
  "previousProofSha256": null,
  "previousCheckpointSha256": null,
  "subject": {
    "subjectId": "holdout_untrusted_fixture_001",
    "subjectSha256": "3333333333333333333333333333333333333333333333333333333333333333",
    "subjectContractVersion": "m3-1-holdout-projection-v1",
    "subjectPurpose": "holdout-freeze",
    "subjectMediaType": "application/json"
  },
  "workflowIdentity": {
    "issuer": "https://issuer.example.invalid",
    "subject": "repo:synthetic-org/synthetic-repo:ref:refs/heads/main",
    "repository": "synthetic-org/synthetic-repo",
    "workflowPath": ".github/workflows/m3-1-attest.yml",
    "workflowRef": "synthetic-org/synthetic-repo/.github/workflows/m3-1-attest.yml@refs/heads/main",
    "oidcAudience": "synthetic-attestation-fixture",
    "commitSha": "4444444444444444444444444444444444444444",
    "runId": "1000001",
    "runAttempt": 1
  },
  "trustPolicyId": "attestor_policy_untrusted_fixture_001",
  "trustPolicySha256": "5555555555555555555555555555555555555555555555555555555555555555",
  "verificationMaterial": {
    "bundleSha256": "6666666666666666666666666666666666666666666666666666666666666666",
    "certificateSha256": "7777777777777777777777777777777777777777777777777777777777777777",
    "signatureSha256": "8888888888888888888888888888888888888888888888888888888888888888",
    "publicKeyFingerprintSha256": "9999999999999999999999999999999999999999999999999999999999999999"
  },
  "transparencyCheckpoint": {
    "logId": "untrusted-log-fixture",
    "entryId": "untrusted-entry-fixture",
    "integratedAt": "2026-08-23T00:00:01Z",
    "checkpointSha256": "aaaaaaaaaaaaaaaaaaaaaaaaaaaaaaaaaaaaaaaaaaaaaaaaaaaaaaaaaaaaaaaa",
    "inclusionProofSha256": "bbbbbbbbbbbbbbbbbbbbbbbbbbbbbbbbbbbbbbbbbbbbbbbbbbbbbbbbbbbbbbbb"
  },
  "signatureCryptographicallyVerified": false,
  "subjectBindingVerified": false,
  "workflowIdentityVerified": false,
  "trustPolicyMatched": false,
  "lifecycleValid": false,
  "replayCheckPassed": false,
  "rollbackCheckPassed": false,
  "externalVerificationRequired": true,
  "evidenceTrust": "untrusted"
}
